{
  "schema_version": "3.0.0-draft",
  "artifact_kind": "mission_lock_submission_copy",
  "candidate_id": "candidate_025",
  "mission_id": "mission_025",
  "dacon_receipt_id": "DACON-SCPC2026-025",
  "submitted_at": "2026-07-31T02:55:04+09:00",
  "timezone": "Asia/Seoul",
  "locked_content": {
    "target_user": "대상 사용자는 배달앱의 식당·메뉴·옵션 구조에 익숙하지 않거나 복잡한 선택 과정에 부담을 느끼면서도 배달 주문을 반복적으로 이용하는 사람이다.",
    "core_problem": "기존 배달앱에서는 원하는 식당과 메뉴를 직접 찾고, 해당 메뉴의 옵션(양, 맵기 등)을 일일이 선택해야 한다. 일부 앱의 재주문 기능은 이전 주문을 그대로 불러오지만 평소 취향과 그때만의 선택을 구분하지 못하므로, 예산이나 현재 식사 조건이 달라지면 사용자가 다시 조정해야 한다. 또한 주문 탐색 중 앱이 종료되면 사용자는 비교하던 후보와 판단 과정을 다시 확인해야 한다.",
    "long_horizon_goal": "여러 주문 session 을 거치며 사용자가 대화로 원하는 음식과 현재 조건을 입력하면, 앱은 적합한 식당·메뉴 후보를 추천한다. 사용자가 선택한 식당·메뉴에 대하여 주문 항목별 주문서 초안을 구성한다. 반복할수록 사용자는 새로 정하거나 이번에 바꾸려는 항목만 확인·수정하고, 주문 과정이 중단되거나 조건이 바뀌어도 이미 유효한 선택은 유지된다.",
    "primary_value": "현재 상황과 취향에 맞는 유효한 개인 주문 초안을 완성하기까지 필요한 탐색·선택의 반복 부담을 줄이는 것이다. 다만 사용자의 현재 요청과 변경·삭제 의사를 반영하고, 현재 주문 가능한 메뉴와 옵션을 지켜야 한다.",
    "e1_e4_causal_chain": [
      "E1 학습(Learn). 사용자가 모든 주문에 적용할 기본 취향, 식당을 넘어 같은 메뉴 유형에 적용할 취향, 특정 식당·메뉴에만 적용할 예외와 자동 적용 허용 범위를 현재 주문만의 조건과 구분해 저장한다. 주문 뒤 평점은 해당 식당·메뉴의 추천 근거로 남기고, 리뷰에서 추출한 옵션 취향 후보는 적용 범위를 물어본 뒤 동의한 범위에만 저장한다.",
      "E2 재사용(Reuse). 다음 주문에서는 현재 지시를 먼저 따르고, 해당 식당·메뉴에 저장된 예외 취향, 메뉴 정보상 같은 유형으로 연결된 취향, 전역 기본 취향 순으로 유효하고 자동 적용이 허용된 값을 각 주문 항목에 채운다. 다른 대상·목표의 기록과 미승인 리뷰 후보는 제외한다.",
      "E3 예외(Exception). 현재의 일회성 지시가 저장된 취향과 충돌하거나 특정 항목의 자동 적용 허용이 철회되면, 과거 방식을 그대로 실행하지 않고 현재 지시를 우선해 해당 항목만 다시 판단한다. 안정 취향과 다른 항목의 허용 범위는 보존한다.",
      "E4 복구(Recover). 품절 같은 조건 변화와 process 종료·재실행 뒤에도 영향받은 주문 항목만 다시 선택하고, 이미 유효하게 확정된 항목은 보존한다. 실행되지 않은 주문을 완료된 것으로 표시하거나 중복 실행하지 않으며, 삭제한 값이나 현재보다 오래된 기록을 부활시키지 않는다. \n대표 인과변화: E1 의 전역·메뉴 유형 취향은 E2 의 새 식당 초안과 질문을 바꾸고, E2 리뷰에서 승인한 식당·메뉴별 예외는 E4 에서 동일한 식당·메뉴 조합의 초안 값을 바꾼다. E3 의 수저 자동 적용 철회 뒤 E4 에서는 수저만 다시 묻고, 사이드 품절 시에는 사이드·가격·총액만 다시 계산한다."
    ]
  }
}