{
  "schema_version": "3.0.0-draft",
  "artifact_kind": "mission_lock_submission_copy",
  "candidate_id": "EXAMPLE_CANDIDATE",
  "mission_id": "EXAMPLE_MISSION",
  "dacon_receipt_id": "DACON-RECEIPT-EXAMPLE-001",
  "submitted_at": "2026-01-01T12:00:00+09:00",
  "timezone": "Asia/Seoul",
  "locked_content": {
    "target_user": "반복되는 준비 업무를 모바일에서 관리하는 예시 사용자",
    "core_problem": "여러 세션에 걸친 준비 상태를 기억하되 현재 지시와 삭제를 우선해야 합니다.",
    "long_horizon_goal": "재시작과 상황 변경 뒤에도 유효한 준비 상태만 이어서 다음 결정을 돕습니다.",
    "primary_value": "반복 준비 부담 감소",
    "e1_e4_causal_chain": [
      "E1: 첫 세션에서 장기 선호와 이번 한 번의 제약을 구분해 저장합니다.",
      "E2: 다음 세션에서는 유효한 장기 선호만 재사용해 입력 부담을 줄입니다.",
      "E3: 사용자의 정정·철회·삭제가 오면 영향을 받는 상태만 무효화합니다.",
      "E4: 앱 재시작 뒤 유효한 상태와 삭제표식을 복구해 안전하게 이어갑니다."
    ]
  }
}
